{
	"version": "0.0",
	"lastUpdated": "2024-11-18T18:25:25.171Z",
	"testMethods": {
		"yaUT_testMethod": {
			"name": "yaUT_testMethod",
			"defaultPriority": 2,
			"description": "",
			"kind": "smoke"
		}
	},
	"testGroups": {
		"group_A": {
			"name": "group_B",
			"description": "xxxx",
			"tags": [],
			"tests": [],
			"includeGroups": [],
			"defaultPriority": 4
		},
		"group_B": {
			"name": "group_B",
			"description": "xxxx",
			"tags": [],
			"tests": [],
			"includeGroups": []
		}
	}
}